Practica_5075_Integridad_KDD_Postigo_Rodríguez_Ángel/output_samples/metricas_perfilado.json

{
    "calidad_iso_25012": {
        "tasa_completitud_porcentaje": 90.0,
        "integridad_criptografica": {
            "archivos_validados": 2,
            "archivos_rechazados": 1
        }
    },
    "distribucion_importe_eur": {
        "media": 161.41,
        "mediana": 74.48,
        "desviacion_estandar": 528.78,
        "percentil_25": 55.22,
        "percentil_75": 88.57
    }
}

Practica_5075_Integridad_KDD_Postigo_Rodríguez_Ángel/reports/INFORME_CALIDAD_KDD.md

## 3. Métricas de Distribución Post-Saneamiento (Fase 3)

{
    "calidad_iso_25012": {
        "tasa_completitud_porcentaje": 90.0,
        "integridad_criptografica": {
            "archivos_validados": 2,
            "archivos_rechazados": 1
        }
    },
    "distribucion_importe_eur": {
        "media": 161.41,
        "mediana": 74.48,
        "desviacion_estandar": 528.78,
        "percentil_25": 55.22,
        "percentil_75": 88.57
    }
}